AccountNotDelegated;AllowReversiblePasswordEncryption;AuthenticationPolicy;AuthenticationPolicySilo;BadLogonCount;CN;CannotChangePassword;CanonicalName;Certificates;CompoundIdentitySupported;Created;DNSHostName;DisplayName;DistinguishedName;DoesNotRequirePreAuth;Enabled;HomedirRequired;IPv4Address;IPv6Address;KerberosEncryptionType;LastBadPasswordAttempt;LastKnownParent;LastLogonDate;Location;LockedOut;MNSLogonAccount;MemberOf;Modified;Name;ObjectCategory;ObjectClass;ObjectGUID;OperatingSystem;OperatingSystemServicePack;OperatingSystemVersion;PasswordExpired;PasswordLastSet;PasswordNeverExpires;PasswordNotRequired;PrimaryGroup;PrincipalsAllowedToDelegateToAccount;ProtectedFromAccidentalDeletion;SID;SIDHistory;SamAccountName;ServiceAccount;ServicePrincipalNames;TrustedForDelegation;TrustedToAuthForDelegation;UseDESKeyOnly;accountExpires;badPasswordTime;badPwdCount;codePage;countryCode;createTimeStamp;dSCorePropagationData;instanceType;isCriticalSystemObject;lastLogoff;lastLogon;lastLogonTimestamp;localPolicyFlags;lockoutTime;logonCount;mS-DS-CreatorSID;modifyTimeStamp;msDFSR-ComputerReferenceBL;msDS-GenerationId;msDS-LastKnownRDN;msDS-SupportedEncryptionTypes;msDS-User-Account-Control-Computed;msExchRMSComputerAccountsBL;nTSecurityDescriptor;objectSid;primaryGroupID;pwdLastSet;rIDSetReferences;sAMAccountType;sDRightsEffective;serverReferenceBL;servicePrincipalName;uSNChanged;uSNCreated;userAccountControl;userCertificate;whenChanged;whenCreated
False;False;;;;WJW-SRV-DC02;False;wjwgmbh.local/Domain Controllers/Domäne/WJW-SRV-DC02;"System.Security.Cryptography.X509Certificates.X509Certificate; System.Security.Cryptography.X509Certificates.X509Certificate";False;/Date(1575899437000)/;WJW-SRV-DC02.wjwgmbh.local;;CN=WJW-SRV-DC02,OU=Domäne,OU=Domain Controllers,DC=wjwgmbh,DC=local;False;True;False;172.20.20.52;;RC4, AES128, AES256;;;/Date(1778103411850)/;;False;False;;/Date(1778103727000)/;WJW-SRV-DC02;CN=Computer,CN=Schema,CN=Configuration,DC=wjwgmbh,DC=local;computer;5cfdd758-ff6d-47a6-b172-cc222af30c01;Windows Server 2019 Datacenter;;10.0 (17763);False;/Date(1776092686540)/;False;False;CN=Domänencontroller,CN=Users,DC=wjwgmbh,DC=local;;False;{'BinaryLength': 28, 'AccountDomainSid': 'S-1-5-21-1988211537-2355475510-3724178502', 'Value': 'S-1-5-21-1988211537-2355475510-3724178502-4625'};;WJW-SRV-DC02$;;"RPC/894ffb37-67ee-487f-9c19-00266bcb5fc8._msdcs.wjwgmbh.local; HOST/WJW-SRV-DC02/WJWGMBH; HOST/WJW-SRV-DC02.wjwgmbh.local/WJWGMBH; GC/WJW-SRV-DC02.wjwgmbh.local/wjwgmbh.local; exchangeAB/WJW-SRV-DC02.wjwgmbh.local; HOST/WJW-SRV-DC02.wjwgmbh.local/wjwgmbh.local; exchangeAB/WJW-SRV-DC02; ldap/WJW-SRV-DC02/WJWGMBH; ldap/894ffb37-67ee-487f-9c19-00266bcb5fc8._msdcs.wjwgmbh.local; ldap/WJW-SRV-DC02.wjwgmbh.local/WJWGMBH; ldap/WJW-SRV-DC02; ldap/WJW-SRV-DC02.wjwgmbh.local; ldap/WJW-SRV-DC02.wjwgmbh.local/ForestDnsZones.wjwgmbh.local; ldap/WJW-SRV-DC02.wjwgmbh.local/DomainDnsZones.wjwgmbh.local; ldap/WJW-SRV-DC02.wjwgmbh.local/wjwgmbh.local; DNS/WJW-SRV-DC02.wjwgmbh.local; Dfsr-12F9A27C-BF97-4787-9364-D31B6C55EB04/WJW-SRV-DC02.wjwgmbh.local; E3514235-4B06-11D1-AB04-00C04FC2DCD2/894ffb37-67ee-487f-9c19-00266bcb5fc8/wjwgmbh.local; WSMAN/WJW-SRV-DC02; WSMAN/WJW-SRV-DC02.wjwgmbh.local; TERMSRV/WJW-SRV-DC02.wjwgmbh.local; TERMSRV/WJW-SRV-DC02; RestrictedKrbHost/WJW-SRV-DC02; HOST/WJW-SRV-DC02; RestrictedKrbHost/WJW-SRV-DC02.wjwgmbh.local; HOST/WJW-SRV-DC02.wjwgmbh.local";True;False;False;9223372036854775807;;;0;0;/Date(1575899437000)/;"15.05.2024 14:52:13; 01.01.1601 01:00:01";4;True;;;134225770118500002;0;;;;/Date(1778103727000)/;CN=WJW-SRV-DC02,CN=Topology,CN=Domain System Volume,CN=DFSR-GlobalSettings,CN=System,DC=wjwgmbh,DC=local;;;28;0;;{'AccessRightType': 'System.DirectoryServices.ActiveDirectoryRights', 'AccessRuleType': 'System.DirectoryServices.ActiveDirectoryAccessRule', 'AuditRuleType': 'System.DirectoryServices.ActiveDirectoryAuditRule', 'AreAccessRulesProtected': False, 'AreAuditRulesProtected': False, 'AreAccessRulesCanonical': True, 'AreAuditRulesCanonical': True};{'BinaryLength': 28, 'AccountDomainSid': 'S-1-5-21-1988211537-2355475510-3724178502', 'Value': 'S-1-5-21-1988211537-2355475510-3724178502-4625'};516;134205662865409873;CN=RID Set,CN=WJW-SRV-DC02,OU=Domäne,OU=Domain Controllers,DC=wjwgmbh,DC=local;805306369;0;CN=WJW-SRV-DC02,CN=Servers,CN=Domaene_Mechtildshausen,CN=Sites,CN=Configuration,DC=wjwgmbh,DC=local;"RPC/894ffb37-67ee-487f-9c19-00266bcb5fc8._msdcs.wjwgmbh.local; HOST/WJW-SRV-DC02/WJWGMBH; HOST/WJW-SRV-DC02.wjwgmbh.local/WJWGMBH; GC/WJW-SRV-DC02.wjwgmbh.local/wjwgmbh.local; exchangeAB/WJW-SRV-DC02.wjwgmbh.local; HOST/WJW-SRV-DC02.wjwgmbh.local/wjwgmbh.local; exchangeAB/WJW-SRV-DC02; ldap/WJW-SRV-DC02/WJWGMBH; ldap/894ffb37-67ee-487f-9c19-00266bcb5fc8._msdcs.wjwgmbh.local; ldap/WJW-SRV-DC02.wjwgmbh.local/WJWGMBH; ldap/WJW-SRV-DC02; ldap/WJW-SRV-DC02.wjwgmbh.local; ldap/WJW-SRV-DC02.wjwgmbh.local/ForestDnsZones.wjwgmbh.local; ldap/WJW-SRV-DC02.wjwgmbh.local/DomainDnsZones.wjwgmbh.local; ldap/WJW-SRV-DC02.wjwgmbh.local/wjwgmbh.local; DNS/WJW-SRV-DC02.wjwgmbh.local; Dfsr-12F9A27C-BF97-4787-9364-D31B6C55EB04/WJW-SRV-DC02.wjwgmbh.local; E3514235-4B06-11D1-AB04-00C04FC2DCD2/894ffb37-67ee-487f-9c19-00266bcb5fc8/wjwgmbh.local; WSMAN/WJW-SRV-DC02; WSMAN/WJW-SRV-DC02.wjwgmbh.local; TERMSRV/WJW-SRV-DC02.wjwgmbh.local; TERMSRV/WJW-SRV-DC02; RestrictedKrbHost/WJW-SRV-DC02; HOST/WJW-SRV-DC02; RestrictedKrbHost/WJW-SRV-DC02.wjwgmbh.local; HOST/WJW-SRV-DC02.wjwgmbh.local";16451937;13510;532480;"System.Byte[]; System.Byte[]";/Date(1778103727000)/;/Date(1575899437000)/
False;False;;;;WJW-SRV-DC01;False;wjwgmbh.local/Domain Controllers/Domäne/WJW-SRV-DC01;"System.Security.Cryptography.X509Certificates.X509Certificate; System.Security.Cryptography.X509Certificates.X509Certificate";False;/Date(1575899129000)/;WJW-SRV-DC01.wjwgmbh.local;;CN=WJW-SRV-DC01,OU=Domäne,OU=Domain Controllers,DC=wjwgmbh,DC=local;False;True;False;172.20.20.51;;RC4, AES128, AES256;;;/Date(1778062444237)/;;False;False;;/Date(1778629717000)/;WJW-SRV-DC01;CN=Computer,CN=Schema,CN=Configuration,DC=wjwgmbh,DC=local;computer;3831eddf-edeb-4c36-aac2-904e31e40517;Windows Server 2019 Datacenter;;10.0 (17763);False;/Date(1778629415776)/;False;False;CN=Domänencontroller,CN=Users,DC=wjwgmbh,DC=local;;False;{'BinaryLength': 28, 'AccountDomainSid': 'S-1-5-21-1988211537-2355475510-3724178502', 'Value': 'S-1-5-21-1988211537-2355475510-3724178502-4128'};;WJW-SRV-DC01$;;"DNS/WJW-SRV-DC01.wjwgmbh.local; RPC/d8d3b90e-6c9a-4ab1-8dee-f7b48fbdbe37._msdcs.wjwgmbh.local; HOST/WJW-SRV-DC01/WJWGMBH; HOST/WJW-SRV-DC01.wjwgmbh.local/WJWGMBH; GC/WJW-SRV-DC01.wjwgmbh.local/wjwgmbh.local; exchangeAB/WJW-SRV-DC01.wjwgmbh.local; HOST/WJW-SRV-DC01.wjwgmbh.local/wjwgmbh.local; exchangeAB/WJW-SRV-DC01; ldap/WJW-SRV-DC01/WJWGMBH; ldap/d8d3b90e-6c9a-4ab1-8dee-f7b48fbdbe37._msdcs.wjwgmbh.local; ldap/WJW-SRV-DC01.wjwgmbh.local/WJWGMBH; ldap/WJW-SRV-DC01; ldap/WJW-SRV-DC01.wjwgmbh.local; ldap/WJW-SRV-DC01.wjwgmbh.local/ForestDnsZones.wjwgmbh.local; ldap/WJW-SRV-DC01.wjwgmbh.local/DomainDnsZones.wjwgmbh.local; ldap/WJW-SRV-DC01.wjwgmbh.local/wjwgmbh.local; E3514235-4B06-11D1-AB04-00C04FC2DCD2/d8d3b90e-6c9a-4ab1-8dee-f7b48fbdbe37/wjwgmbh.local; Dfsr-12F9A27C-BF97-4787-9364-D31B6C55EB04/WJW-SRV-DC01.wjwgmbh.local; TERMSRV/WJW-SRV-DC01; TERMSRV/WJW-SRV-DC01.wjwgmbh.local; WSMAN/WJW-SRV-DC01; WSMAN/WJW-SRV-DC01.wjwgmbh.local; RestrictedKrbHost/WJW-SRV-DC01; HOST/WJW-SRV-DC01; RestrictedKrbHost/WJW-SRV-DC01.wjwgmbh.local; HOST/WJW-SRV-DC01.wjwgmbh.local";True;False;False;9223372036854775807;;;0;0;/Date(1575899129000)/;"15.05.2024 14:52:13; 01.01.1601 01:00:01";4;True;;;134225360442372566;0;;;;/Date(1778629717000)/;CN=WJW-SRV-DC01,CN=Topology,CN=Domain System Volume,CN=DFSR-GlobalSettings,CN=System,DC=wjwgmbh,DC=local;;;28;0;;{'AccessRightType': 'System.DirectoryServices.ActiveDirectoryRights', 'AccessRuleType': 'System.DirectoryServices.ActiveDirectoryAccessRule', 'AuditRuleType': 'System.DirectoryServices.ActiveDirectoryAuditRule', 'AreAccessRulesProtected': False, 'AreAuditRulesProtected': False, 'AreAccessRulesCanonical': True, 'AreAuditRulesCanonical': True};{'BinaryLength': 28, 'AccountDomainSid': 'S-1-5-21-1988211537-2355475510-3724178502', 'Value': 'S-1-5-21-1988211537-2355475510-3724178502-4128'};516;134231030157765659;CN=RID Set,CN=WJW-SRV-DC01,OU=Domäne,OU=Domain Controllers,DC=wjwgmbh,DC=local;805306369;0;CN=WJW-SRV-DC01,CN=Servers,CN=Domaene_Mechtildshausen,CN=Sites,CN=Configuration,DC=wjwgmbh,DC=local;"DNS/WJW-SRV-DC01.wjwgmbh.local; RPC/d8d3b90e-6c9a-4ab1-8dee-f7b48fbdbe37._msdcs.wjwgmbh.local; HOST/WJW-SRV-DC01/WJWGMBH; HOST/WJW-SRV-DC01.wjwgmbh.local/WJWGMBH; GC/WJW-SRV-DC01.wjwgmbh.local/wjwgmbh.local; exchangeAB/WJW-SRV-DC01.wjwgmbh.local; HOST/WJW-SRV-DC01.wjwgmbh.local/wjwgmbh.local; exchangeAB/WJW-SRV-DC01; ldap/WJW-SRV-DC01/WJWGMBH; ldap/d8d3b90e-6c9a-4ab1-8dee-f7b48fbdbe37._msdcs.wjwgmbh.local; ldap/WJW-SRV-DC01.wjwgmbh.local/WJWGMBH; ldap/WJW-SRV-DC01; ldap/WJW-SRV-DC01.wjwgmbh.local; ldap/WJW-SRV-DC01.wjwgmbh.local/ForestDnsZones.wjwgmbh.local; ldap/WJW-SRV-DC01.wjwgmbh.local/DomainDnsZones.wjwgmbh.local; ldap/WJW-SRV-DC01.wjwgmbh.local/wjwgmbh.local; E3514235-4B06-11D1-AB04-00C04FC2DCD2/d8d3b90e-6c9a-4ab1-8dee-f7b48fbdbe37/wjwgmbh.local; Dfsr-12F9A27C-BF97-4787-9364-D31B6C55EB04/WJW-SRV-DC01.wjwgmbh.local; TERMSRV/WJW-SRV-DC01; TERMSRV/WJW-SRV-DC01.wjwgmbh.local; WSMAN/WJW-SRV-DC01; WSMAN/WJW-SRV-DC01.wjwgmbh.local; RestrictedKrbHost/WJW-SRV-DC01; HOST/WJW-SRV-DC01; RestrictedKrbHost/WJW-SRV-DC01.wjwgmbh.local; HOST/WJW-SRV-DC01.wjwgmbh.local";16529041;13512;532480;"System.Byte[]; System.Byte[]";/Date(1778629717000)/;/Date(1575899129000)/
False;False;;;;WJW-SRV-DC04;False;wjwgmbh.local/Server/WJW-SRV-DC04;"System.Security.Cryptography.X509Certificates.X509Certificate; System.Security.Cryptography.X509Certificates.X509Certificate";False;/Date(1615379696000)/;WJW-SRV-DC04.wjwgmbh.local;;CN=WJW-SRV-DC04,OU=Server,DC=wjwgmbh,DC=local;False;True;False;172.20.10.12;;RC4, AES128, AES256;;;/Date(1667451717043)/;;False;False;;/Date(1670253327000)/;WJW-SRV-DC04;CN=Computer,CN=Schema,CN=Configuration,DC=wjwgmbh,DC=local;computer;7fa3f73b-e0f6-4d25-8a55-ca6e30b7c896;Windows Server 2019 Datacenter;;10.0 (17763);False;/Date(1665188478807)/;False;False;CN=Domänencomputer,CN=Users,DC=wjwgmbh,DC=local;;False;{'BinaryLength': 28, 'AccountDomainSid': 'S-1-5-21-1988211537-2355475510-3724178502', 'Value': 'S-1-5-21-1988211537-2355475510-3724178502-6610'};;WJW-SRV-DC04$;;"exchangeAB/WJW-SRV-DC04.wjwgmbh.local; HOST/WJW-SRV-DC04.wjwgmbh.local/WJWGMBH; HOST/WJW-SRV-DC04/WJWGMBH; DNS/WJW-SRV-DC04.wjwgmbh.local; HOST/WJW-SRV-DC04.wjwgmbh.local/wjwgmbh.local; exchangeAB/WJW-SRV-DC04; Dfsr-12F9A27C-BF97-4787-9364-D31B6C55EB04/WJW-SRV-DC04.wjwgmbh.local; WSMAN/WJW-SRV-DC04; WSMAN/WJW-SRV-DC04.wjwgmbh.local; TERMSRV/WJW-SRV-DC04; TERMSRV/WJW-SRV-DC04.wjwgmbh.local; RestrictedKrbHost/WJW-SRV-DC04; HOST/WJW-SRV-DC04; RestrictedKrbHost/WJW-SRV-DC04.wjwgmbh.local; HOST/WJW-SRV-DC04.wjwgmbh.local";False;False;False;9223372036854775807;;;0;0;/Date(1615379696000)/;"15.05.2024 14:52:13; 05.12.2022 16:15:27; 04.11.2022 14:54:50; 01.01.1601 19:16:33";4;False;;133120449312136748;133119253170438581;0;;6;;/Date(1670253327000)/;;;;28;0;;{'AccessRightType': 'System.DirectoryServices.ActiveDirectoryRights', 'AccessRuleType': 'System.DirectoryServices.ActiveDirectoryAccessRule', 'AuditRuleType': 'System.DirectoryServices.ActiveDirectoryAuditRule', 'AreAccessRulesProtected': False, 'AreAuditRulesProtected': False, 'AreAccessRulesCanonical': True, 'AreAuditRulesCanonical': True};{'BinaryLength': 28, 'AccountDomainSid': 'S-1-5-21-1988211537-2355475510-3724178502', 'Value': 'S-1-5-21-1988211537-2355475510-3724178502-6610'};515;133096620788075587;;805306369;0;;"exchangeAB/WJW-SRV-DC04.wjwgmbh.local; HOST/WJW-SRV-DC04.wjwgmbh.local/WJWGMBH; HOST/WJW-SRV-DC04/WJWGMBH; DNS/WJW-SRV-DC04.wjwgmbh.local; HOST/WJW-SRV-DC04.wjwgmbh.local/wjwgmbh.local; exchangeAB/WJW-SRV-DC04; Dfsr-12F9A27C-BF97-4787-9364-D31B6C55EB04/WJW-SRV-DC04.wjwgmbh.local; WSMAN/WJW-SRV-DC04; WSMAN/WJW-SRV-DC04.wjwgmbh.local; TERMSRV/WJW-SRV-DC04; TERMSRV/WJW-SRV-DC04.wjwgmbh.local; RestrictedKrbHost/WJW-SRV-DC04; HOST/WJW-SRV-DC04; RestrictedKrbHost/WJW-SRV-DC04.wjwgmbh.local; HOST/WJW-SRV-DC04.wjwgmbh.local";388758;13519;4096;"System.Byte[]; System.Byte[]";/Date(1670253327000)/;/Date(1615379696000)/
False;False;;;0;WJW-SRV-DC03;False;wjwgmbh.local/Domain Controllers/Wiesbaden/WJW-SRV-DC03;"System.Security.Cryptography.X509Certificates.X509Certificate; System.Security.Cryptography.X509Certificates.X509Certificate";False;/Date(1615379724000)/;WJW-SRV-DC03.wjwgmbh.local;;CN=WJW-SRV-DC03,OU=Wiesbaden,OU=Domain Controllers,DC=wjwgmbh,DC=local;False;True;False;172.20.10.11;;RC4, AES128, AES256;/Date(1726611459348)/;;/Date(1778604682149)/;;False;False;;/Date(1778605056000)/;WJW-SRV-DC03;CN=Computer,CN=Schema,CN=Configuration,DC=wjwgmbh,DC=local;computer;1fec3e78-e299-4d78-8e7e-046b383801e3;Windows Server 2019 Datacenter;;10.0 (17763);False;/Date(1776077938358)/;False;False;CN=Domänencontroller,CN=Users,DC=wjwgmbh,DC=local;;False;{'BinaryLength': 28, 'AccountDomainSid': 'S-1-5-21-1988211537-2355475510-3724178502', 'Value': 'S-1-5-21-1988211537-2355475510-3724178502-6200'};;WJW-SRV-DC03$;;"Dfsr-12F9A27C-BF97-4787-9364-D31B6C55EB04/WJW-SRV-DC03.wjwgmbh.local; HOST/WJW-SRV-DC03.wjwgmbh.local/wjwgmbh.local; exchangeAB/WJW-SRV-DC03.wjwgmbh.local; GC/WJW-SRV-DC03.wjwgmbh.local/wjwgmbh.local; HOST/WJW-SRV-DC03.wjwgmbh.local/WJWGMBH; HOST/WJW-SRV-DC03/WJWGMBH; RPC/6515e0f2-0d13-4010-8805-e9f73e22aafa._msdcs.wjwgmbh.local; DNS/WJW-SRV-DC03.wjwgmbh.local; exchangeAB/WJW-SRV-DC03; ldap/WJW-SRV-DC03/WJWGMBH; ldap/WJW-SRV-DC03.wjwgmbh.local/wjwgmbh.local; ldap/WJW-SRV-DC03.wjwgmbh.local/DomainDnsZones.wjwgmbh.local; ldap/WJW-SRV-DC03.wjwgmbh.local/ForestDnsZones.wjwgmbh.local; ldap/WJW-SRV-DC03.wjwgmbh.local; ldap/WJW-SRV-DC03; ldap/WJW-SRV-DC03.wjwgmbh.local/WJWGMBH; ldap/6515e0f2-0d13-4010-8805-e9f73e22aafa._msdcs.wjwgmbh.local; E3514235-4B06-11D1-AB04-00C04FC2DCD2/6515e0f2-0d13-4010-8805-e9f73e22aafa/wjwgmbh.local; WSMAN/WJW-SRV-DC03; WSMAN/WJW-SRV-DC03.wjwgmbh.local; TERMSRV/WJW-SRV-DC03; TERMSRV/WJW-SRV-DC03.wjwgmbh.local; RestrictedKrbHost/WJW-SRV-DC03; HOST/WJW-SRV-DC03; RestrictedKrbHost/WJW-SRV-DC03.wjwgmbh.local; HOST/WJW-SRV-DC03.wjwgmbh.local";True;False;False;9223372036854775807;133710850593489860;0;0;0;/Date(1615379724000)/;"15.05.2024 14:52:13; 01.01.1601 01:00:01";4;True;;134210971432321796;134230782821491253;0;;233;;/Date(1778605056000)/;CN=WJW-SRV-DC03,CN=Topology,CN=Domain System Volume,CN=DFSR-GlobalSettings,CN=System,DC=wjwgmbh,DC=local;;;28;0;;{'AccessRightType': 'System.DirectoryServices.ActiveDirectoryRights', 'AccessRuleType': 'System.DirectoryServices.ActiveDirectoryAccessRule', 'AuditRuleType': 'System.DirectoryServices.ActiveDirectoryAuditRule', 'AreAccessRulesProtected': False, 'AreAuditRulesProtected': False, 'AreAccessRulesCanonical': True, 'AreAuditRulesCanonical': True};{'BinaryLength': 28, 'AccountDomainSid': 'S-1-5-21-1988211537-2355475510-3724178502', 'Value': 'S-1-5-21-1988211537-2355475510-3724178502-6200'};516;134205515383586047;CN=RID Set,CN=WJW-SRV-DC03,OU=Wiesbaden,OU=Domain Controllers,DC=wjwgmbh,DC=local;805306369;0;CN=WJW-SRV-DC03,CN=Servers,CN=Hasengartenstrasse,CN=Sites,CN=Configuration,DC=wjwgmbh,DC=local;"Dfsr-12F9A27C-BF97-4787-9364-D31B6C55EB04/WJW-SRV-DC03.wjwgmbh.local; HOST/WJW-SRV-DC03.wjwgmbh.local/wjwgmbh.local; exchangeAB/WJW-SRV-DC03.wjwgmbh.local; GC/WJW-SRV-DC03.wjwgmbh.local/wjwgmbh.local; HOST/WJW-SRV-DC03.wjwgmbh.local/WJWGMBH; HOST/WJW-SRV-DC03/WJWGMBH; RPC/6515e0f2-0d13-4010-8805-e9f73e22aafa._msdcs.wjwgmbh.local; DNS/WJW-SRV-DC03.wjwgmbh.local; exchangeAB/WJW-SRV-DC03; ldap/WJW-SRV-DC03/WJWGMBH; ldap/WJW-SRV-DC03.wjwgmbh.local/wjwgmbh.local; ldap/WJW-SRV-DC03.wjwgmbh.local/DomainDnsZones.wjwgmbh.local; ldap/WJW-SRV-DC03.wjwgmbh.local/ForestDnsZones.wjwgmbh.local; ldap/WJW-SRV-DC03.wjwgmbh.local; ldap/WJW-SRV-DC03; ldap/WJW-SRV-DC03.wjwgmbh.local/WJWGMBH; ldap/6515e0f2-0d13-4010-8805-e9f73e22aafa._msdcs.wjwgmbh.local; E3514235-4B06-11D1-AB04-00C04FC2DCD2/6515e0f2-0d13-4010-8805-e9f73e22aafa/wjwgmbh.local; WSMAN/WJW-SRV-DC03; WSMAN/WJW-SRV-DC03.wjwgmbh.local; TERMSRV/WJW-SRV-DC03; TERMSRV/WJW-SRV-DC03.wjwgmbh.local; RestrictedKrbHost/WJW-SRV-DC03; HOST/WJW-SRV-DC03; RestrictedKrbHost/WJW-SRV-DC03.wjwgmbh.local; HOST/WJW-SRV-DC03.wjwgmbh.local";16526967;13521;532480;"System.Byte[]; System.Byte[]";/Date(1778605056000)/;/Date(1615379724000)/
False;False;;;0;WJW-SRV-DC05;False;wjwgmbh.local/Domain Controllers/Wiesbaden/WJW-SRV-DC05;"System.Security.Cryptography.X509Certificates.X509Certificate; System.Security.Cryptography.X509Certificates.X509Certificate";False;/Date(1667483442000)/;WJW-SRV-DC05.wjwgmbh.local;;CN=WJW-SRV-DC05,OU=Wiesbaden,OU=Domain Controllers,DC=wjwgmbh,DC=local;False;True;False;172.20.10.18;;RC4, AES128, AES256;;;/Date(1778501918260)/;hasengarten;False;False;;/Date(1778502450000)/;WJW-SRV-DC05;CN=Computer,CN=Schema,CN=Configuration,DC=wjwgmbh,DC=local;computer;38a05b52-295c-4aab-acc0-e7bad68cfb93;Windows Server 2019 Datacenter;;10.0 (17763);False;/Date(1777960574232)/;False;False;CN=Domänencontroller,CN=Users,DC=wjwgmbh,DC=local;;False;{'BinaryLength': 28, 'AccountDomainSid': 'S-1-5-21-1988211537-2355475510-3724178502', 'Value': 'S-1-5-21-1988211537-2355475510-3724178502-7633'};;WJW-SRV-DC05$;;"Dfsr-12F9A27C-BF97-4787-9364-D31B6C55EB04/WJW-SRV-DC05.wjwgmbh.local; DNS/WJW-SRV-DC05.wjwgmbh.local; RPC/6f1660e3-42ee-411d-85ad-aae09fd05664._msdcs.wjwgmbh.local; HOST/WJW-SRV-DC05/WJWGMBH; HOST/WJW-SRV-DC05.wjwgmbh.local/WJWGMBH; GC/WJW-SRV-DC05.wjwgmbh.local/wjwgmbh.local; exchangeAB/WJW-SRV-DC05.wjwgmbh.local; HOST/WJW-SRV-DC05.wjwgmbh.local/wjwgmbh.local; exchangeAB/WJW-SRV-DC05; ldap/WJW-SRV-DC05/WJWGMBH; ldap/6f1660e3-42ee-411d-85ad-aae09fd05664._msdcs.wjwgmbh.local; ldap/WJW-SRV-DC05.wjwgmbh.local/WJWGMBH; ldap/WJW-SRV-DC05; ldap/WJW-SRV-DC05.wjwgmbh.local; ldap/WJW-SRV-DC05.wjwgmbh.local/ForestDnsZones.wjwgmbh.local; ldap/WJW-SRV-DC05.wjwgmbh.local/DomainDnsZones.wjwgmbh.local; ldap/WJW-SRV-DC05.wjwgmbh.local/wjwgmbh.local; E3514235-4B06-11D1-AB04-00C04FC2DCD2/6f1660e3-42ee-411d-85ad-aae09fd05664/wjwgmbh.local; WSMAN/WJW-SRV-DC05; WSMAN/WJW-SRV-DC05.wjwgmbh.local; TERMSRV/WJW-SRV-DC05; TERMSRV/WJW-SRV-DC05.wjwgmbh.local; RestrictedKrbHost/WJW-SRV-DC05; HOST/WJW-SRV-DC05; RestrictedKrbHost/WJW-SRV-DC05.wjwgmbh.local; HOST/WJW-SRV-DC05.wjwgmbh.local";True;False;False;9223372036854775807;0;0;0;0;/Date(1667483442000)/;"15.05.2024 14:52:13; 28.11.2022 18:48:40; 01.01.1601 01:04:17";4;True;;134231127494731460;134229755182601543;0;;8450;;/Date(1778502450000)/;CN=WJW-SRV-DC05,CN=Topology,CN=Domain System Volume,CN=DFSR-GlobalSettings,CN=System,DC=wjwgmbh,DC=local;"3; 65; 37; 229; 133; 191; 120; 10";;28;0;;{'AccessRightType': 'System.DirectoryServices.ActiveDirectoryRights', 'AccessRuleType': 'System.DirectoryServices.ActiveDirectoryAccessRule', 'AuditRuleType': 'System.DirectoryServices.ActiveDirectoryAuditRule', 'AreAccessRulesProtected': False, 'AreAuditRulesProtected': False, 'AreAccessRulesCanonical': True, 'AreAuditRulesCanonical': True};{'BinaryLength': 28, 'AccountDomainSid': 'S-1-5-21-1988211537-2355475510-3724178502', 'Value': 'S-1-5-21-1988211537-2355475510-3724178502-7633'};516;134224341742323303;CN=RID Set,CN=WJW-SRV-DC05,OU=Wiesbaden,OU=Domain Controllers,DC=wjwgmbh,DC=local;805306369;0;CN=WJW-SRV-DC05,CN=Servers,CN=Hasengartenstrasse,CN=Sites,CN=Configuration,DC=wjwgmbh,DC=local;"Dfsr-12F9A27C-BF97-4787-9364-D31B6C55EB04/WJW-SRV-DC05.wjwgmbh.local; DNS/WJW-SRV-DC05.wjwgmbh.local; RPC/6f1660e3-42ee-411d-85ad-aae09fd05664._msdcs.wjwgmbh.local; HOST/WJW-SRV-DC05/WJWGMBH; HOST/WJW-SRV-DC05.wjwgmbh.local/WJWGMBH; GC/WJW-SRV-DC05.wjwgmbh.local/wjwgmbh.local; exchangeAB/WJW-SRV-DC05.wjwgmbh.local; HOST/WJW-SRV-DC05.wjwgmbh.local/wjwgmbh.local; exchangeAB/WJW-SRV-DC05; ldap/WJW-SRV-DC05/WJWGMBH; ldap/6f1660e3-42ee-411d-85ad-aae09fd05664._msdcs.wjwgmbh.local; ldap/WJW-SRV-DC05.wjwgmbh.local/WJWGMBH; ldap/WJW-SRV-DC05; ldap/WJW-SRV-DC05.wjwgmbh.local; ldap/WJW-SRV-DC05.wjwgmbh.local/ForestDnsZones.wjwgmbh.local; ldap/WJW-SRV-DC05.wjwgmbh.local/DomainDnsZones.wjwgmbh.local; ldap/WJW-SRV-DC05.wjwgmbh.local/wjwgmbh.local; E3514235-4B06-11D1-AB04-00C04FC2DCD2/6f1660e3-42ee-411d-85ad-aae09fd05664/wjwgmbh.local; WSMAN/WJW-SRV-DC05; WSMAN/WJW-SRV-DC05.wjwgmbh.local; TERMSRV/WJW-SRV-DC05; TERMSRV/WJW-SRV-DC05.wjwgmbh.local; RestrictedKrbHost/WJW-SRV-DC05; HOST/WJW-SRV-DC05; RestrictedKrbHost/WJW-SRV-DC05.wjwgmbh.local; HOST/WJW-SRV-DC05.wjwgmbh.local";16512313;13523;532480;"System.Byte[]; System.Byte[]";/Date(1778502450000)/;/Date(1667483442000)/
False;False;;;0;WJW-SRV-RAD01;False;wjwgmbh.local/Server/WJW-SRV-RAD01;"System.Security.Cryptography.X509Certificates.X509Certificate; System.Security.Cryptography.X509Certificates.X509Certificate";False;/Date(1601039677000)/;WJW-SRV-RAD01.wjwgmbh.local;;CN=WJW-SRV-RAD01,OU=Server,DC=wjwgmbh,DC=local;False;True;False;172.20.20.61;;RC4, AES128, AES256;;;/Date(1778049317794)/;;False;False;CN=RAS- und IAS-Server,CN=Users,DC=wjwgmbh,DC=local;/Date(1778618557000)/;WJW-SRV-RAD01;CN=Computer,CN=Schema,CN=Configuration,DC=wjwgmbh,DC=local;computer;e57fda57-3de4-4e90-882b-5a13ccce7a62;Windows Server 2019 Datacenter;;10.0 (17763);False;/Date(1778618264979)/;False;False;CN=Domänencomputer,CN=Users,DC=wjwgmbh,DC=local;;False;{'BinaryLength': 28, 'AccountDomainSid': 'S-1-5-21-1988211537-2355475510-3724178502', 'Value': 'S-1-5-21-1988211537-2355475510-3724178502-6608'};;WJW-SRV-RAD01$;;"WSMAN/WJW-SRV-RAD01; WSMAN/WJW-SRV-RAD01.wjwgmbh.local; TERMSRV/WJW-SRV-RAD01; TERMSRV/WJW-SRV-RAD01.wjwgmbh.local; RestrictedKrbHost/WJW-SRV-RAD01; HOST/WJW-SRV-RAD01; RestrictedKrbHost/WJW-SRV-RAD01.wjwgmbh.local; HOST/WJW-SRV-RAD01.wjwgmbh.local";False;False;False;9223372036854775807;0;0;0;0;/Date(1601039677000)/;"15.05.2024 14:52:13; 01.01.1601 01:00:01";4;False;0;133516026235975999;134225229177947485;0;;5;;/Date(1778618557000)/;;;;28;0;;{'AccessRightType': 'System.DirectoryServices.ActiveDirectoryRights', 'AccessRuleType': 'System.DirectoryServices.ActiveDirectoryAccessRule', 'AuditRuleType': 'System.DirectoryServices.ActiveDirectoryAuditRule', 'AreAccessRulesProtected': False, 'AreAuditRulesProtected': False, 'AreAccessRulesCanonical': True, 'AreAuditRulesCanonical': True};{'BinaryLength': 28, 'AccountDomainSid': 'S-1-5-21-1988211537-2355475510-3724178502', 'Value': 'S-1-5-21-1988211537-2355475510-3724178502-6608'};515;134230918649797891;;805306369;0;;"WSMAN/WJW-SRV-RAD01; WSMAN/WJW-SRV-RAD01.wjwgmbh.local; TERMSRV/WJW-SRV-RAD01; TERMSRV/WJW-SRV-RAD01.wjwgmbh.local; RestrictedKrbHost/WJW-SRV-RAD01; HOST/WJW-SRV-RAD01; RestrictedKrbHost/WJW-SRV-RAD01.wjwgmbh.local; HOST/WJW-SRV-RAD01.wjwgmbh.local";16528127;23548;4096;"System.Byte[]; System.Byte[]";/Date(1778618557000)/;/Date(1601039677000)/
False;False;;;;WJW-SRV-CA01;False;wjwgmbh.local/Server/WJW-SRV-CA01;;False;/Date(1601038344000)/;WJW-SRV-CA01.wjwgmbh.local;;CN=WJW-SRV-CA01,OU=Server,DC=wjwgmbh,DC=local;False;True;False;172.20.20.60;;RC4, AES128, AES256;;;/Date(1778120134542)/;;False;False;"CN=Zertifikatherausgeber,CN=Users,DC=wjwgmbh,DC=local; CN=Prä-Windows 2000 kompatibler Zugriff,CN=Builtin,DC=wjwgmbh,DC=local";/Date(1778120288000)/;WJW-SRV-CA01;CN=Computer,CN=Schema,CN=Configuration,DC=wjwgmbh,DC=local;computer;d56891e3-0d24-465a-a1ee-3ceffa52249f;Windows Server 2019 Datacenter;;10.0 (17763);False;/Date(1777987845899)/;False;False;CN=Domänencomputer,CN=Users,DC=wjwgmbh,DC=local;;False;{'BinaryLength': 28, 'AccountDomainSid': 'S-1-5-21-1988211537-2355475510-3724178502', 'Value': 'S-1-5-21-1988211537-2355475510-3724178502-6135'};;WJW-SRV-CA01$;;"TERMSRV/WJW-SRV-CA01; TERMSRV/WJW-SRV-CA01.wjwgmbh.local; WSMAN/WJW-SRV-CA01; WSMAN/WJW-SRV-CA01.wjwgmbh.local; RestrictedKrbHost/WJW-SRV-CA01; HOST/WJW-SRV-CA01; RestrictedKrbHost/WJW-SRV-CA01.wjwgmbh.local; HOST/WJW-SRV-CA01.wjwgmbh.local";False;False;False;9223372036854775807;;;0;0;/Date(1601038344000)/;"15.05.2024 14:52:13; 01.01.1601 01:00:01";4;False;;;134225937345428626;0;;;;/Date(1778120288000)/;;;;28;0;;{'AccessRightType': 'System.DirectoryServices.ActiveDirectoryRights', 'AccessRuleType': 'System.DirectoryServices.ActiveDirectoryAccessRule', 'AuditRuleType': 'System.DirectoryServices.ActiveDirectoryAuditRule', 'AreAccessRulesProtected': False, 'AreAuditRulesProtected': False, 'AreAccessRulesCanonical': True, 'AreAuditRulesCanonical': True};{'BinaryLength': 28, 'AccountDomainSid': 'S-1-5-21-1988211537-2355475510-3724178502', 'Value': 'S-1-5-21-1988211537-2355475510-3724178502-6135'};515;134224614458994550;;805306369;0;;"TERMSRV/WJW-SRV-CA01; TERMSRV/WJW-SRV-CA01.wjwgmbh.local; WSMAN/WJW-SRV-CA01; WSMAN/WJW-SRV-CA01.wjwgmbh.local; RestrictedKrbHost/WJW-SRV-CA01; HOST/WJW-SRV-CA01; RestrictedKrbHost/WJW-SRV-CA01.wjwgmbh.local; HOST/WJW-SRV-CA01.wjwgmbh.local";16454414;23473;4096;;/Date(1778120288000)/;/Date(1601038344000)/
